Job Title,Job Description,Company Name,Location
Lead DBT/Analytics Engineer,"You will
Develop the best cloud architecture solutions to help the key stakeholders accomplish their strategic goals
Develop data solutions and processes to store, transform and retrieve company information
Build data models and develop an Enterprise Data Model at a large scale
Work with a team of cloud data engineers to install and configure information systems to ensure functionality
Analyze structural requirements for new software, applications and process
Migrate data from legacy systems to cloud solutions
Design conceptual and logical data models and flowcharts
Improve system performance by conducting tests, troubleshooting and integrating new elements
Optimize new and current data systems
Work with security and operations teams to define security and backup procedures
Coordinate with key stakeholders of all data workstreams across departments to identify future needs and requirements

You have
Experience with data transformation tools, orchestration tools and data warehouse. Snowflake, Airflow and DBT preferred.
In-depth understanding of data systems, process and structure principles
Knowledge of data modeling methods such as dimensional modeling, Vault, Star Schema, etc.
Knowledge of data mining and segmentation techniques
Effective communication skills (written and verbal) to properly articulate complicated cloud reports to management and other IT development partners
Exceptional team building and leadership skills
Experience in large-scale, secure, and high-availability solutions in Cloud environments such as Google Cloud (GCP)
Good understanding of GCP services such as IAM, and Google Cloud Storage buckets",Badal,Remote
Design and Product Analyst (Research),"Requisition ID: 202228

Join a purpose driven winning team, committed to results, in an inclusive and high-performing culture.


Is this role right for you?


You will participate and influence the design and product strategy for digital banking experiences across client journeys in trading, investing, and advice

You will understand our customers motivations and needs, leveraging rigorous design research and usability principles along with your intuitive design sense.

You will be data-driven and curious, identifying and proposing quantitative and qualitative opportunities for better reporting, analysis, and ultimately, decision making

You will work closely with CX Design teams focused on discovery work related to important client and advisor problems that we as an organization would like to help resolve. You will partner with product and design experts, including product managers, service designers, behavioural designers, and ux researchers leveraging quantitative and qualitative research methods

You will work closely with the leadership group for the trading investing and advice client journeys team, working with partners to pull appropriate data, create reports, and support strategy development


Do you have the skills that will enable you to succeed in this role?


Bachelors or master’s degree in quantitative/qualitative research methods or equivalent

Experience with Design, Humanities, Systems engineering or related fields (or equivalent work experience) considered an asset.

Experience working with large data sets to extract reports, leveraging basic tools like SQL, equivalent software

Passion and interest in digital product and experience design fields

Ability to communicate concepts, ideas and strategies of Digital Product and Experience Design

Ability to work within the constraints of a Design System with flexibility

A positive and resilient personality with a growth mentality. You must be able to embrace feedback and have a desire for continuous improvement.

We are looking for a fast learner who has an appetite to uncover what’s behind both simple and complex financial solutions.

Proficiency in the use of digital design and prototyping tools such as Figma, Sketch and/or Adobe Creative Suite, Invision, Axure, Proto.io, etc.

Strong understanding of Human-centred Design practices, including Design thinking methodologies, research, and user testing protocols, as well as Agile frameworks.


What's in it for you?



Diversity, Equity, Inclusion & Allyship - We strive to create an inclusive culture where every employee is empowered to reach their fullest potential, respected for who they are, and are embraced through bias-free practices and inclusive values across Scotiabank. We embrace diversity and provide opportunities for all employee to learn, grow & participate through our various Employee Resource Groups (ERGs) that span across diverse gender identities, ethnicity, race, age, ability & veterans.
Accessibility and Workplace Accommodations - We value the unique skills and experiences each individual brings to the Bank, and are committed to creating and maintaining an inclusive and accessible environment for everyone. Scotiabank continues to locate, remove and prevent barriers so that we can build a diverse and inclusive environment while meeting accessibility requirements.
Upskilling through online courses, cross-functional development opportunities, and tuition assistance.
Competitive Rewards program including bonus, flexible vacation, personal, sick days and benefits will start on day one.
Community Engagement - no matter where you choose to work from; we offer opportunities for community engagement & belonging with our various programs such as hackathons, contests, cooking with friends, Humans of Digital and much more!


Location(s): Canada : Ontario : Toronto

Scotiabank is a leading bank in the Americas. Guided by our purpose: ""for every future"", we help our customers, their families and their communities achieve success through a broad range of advice, products and services, including personal and commercial banking, wealth management and private banking, corporate and investment banking, and capital markets.

At Scotiabank, we value the unique skills and experiences each individual brings to the Bank, and are committed to creating and maintaining an inclusive and accessible environment for everyone. If you require accommodation (including, but not limited to, an accessible interview site, alternate format documents, ASL Interpreter, or Assistive Technology) during the recruitment and selection process, please let our Recruitment team know. Candidates must apply directly online to be considered for this role. We thank all applicants for their interest in a career at Scotiabank; however, only those candidates who are selected for an interview will be contacted.",Scotiabank,Toronto
Engineering Analyst- Supply Chain,"Engineering Analyst- Supply Chain
Are you someone who excels in collaborative environment and values teamwork?
As an engineering analyst- supply chain, you will be responsible for working with a team of engineers and analysts in conducting process and data analysis on assigned projects. You will collaborate with project stakeholders in collecting project requirements, developing process maps, conducting detailed data analysis, and time study.
In this role, the successful candidate needs to be onsite at our Langley, BC distribution center.
Join our collaborative team and make an impact as an engineering analyst- supply chain!
What you’ll do:
Apply Lean Six Sigma principles to identify optimization opportunities in existing business processes
Gather project requirements by working with other members of the engineering team and other stakeholders
Perform various detailed data analysis on performance metrics across the distribution center
Support major project planning and implementation
Develop forecasting models for processed data
Perform quantitative simulation
What we’re looking for:
Bachelor’s Degree in Engineering
Minimum 1 year of prior experience
Certified Lean and Six Sigma Green Belt
Experience with data analytics, SQL (PL/SQL), VBA, MS Office Suite (Word, Excel, PowerPoint)
Knowledge of BI (Tableau, Power BI), Statistics, MS vision and Auto CAD is preferred
Why you’ll love it here:
Employee discounts on awesome tech from day one
Flexible health benefits and wellness program
TFSA and RRSP programs
100% matched company pension plan
Training programs to build new and transferable skills
About Best Buy
As Canada's destination for the coolest tech, Best Buy offers one of the best work environments in the country! Annually recognized as one of Canada’s Top 100 Employers, our culture is one of inclusivity and belonging and provides employees an environment where they can bring their whole selves to work.
We believe in a fair and inclusive hiring process. We encourage you to apply even if you may not meet all the requirements.
Join our amazing team!
We are looking for people just like you.
Base pay range
Annual salary: $70,000.00 - $75,000.00
19890 - 92A Avenue, Langley, BC V1M 3A9",Best Buy,Langley
Engineering Manager - Business Intelligence (Remote - Canada),"Summary
Yelp engineering culture is driven by our values: we’re a cooperative team that values individual authenticity and encourages creative solutions to problems. All new engineers deploy working code their first week, and we strive to broaden individual impact with support from managers, mentors, and teams. At the end of the day, we’re all about helping our users, growing as engineers, and having fun in a collaborative environment.

Are you passionate about leveraging data as a product (DaaP) and data visualization? As an Engineering Manager on Yelp’s Business Intelligence team, you’ll work with partners and stakeholders across Yelp, including our Executive Leadership, Finance, BizOps, Product, Data Science, Data Engineering, Marketing, and People teams, to provide relevant data for key business decisions. You will lead, grow, and inspire a team of skilled Business Intelligence Analysts while sharing your passion for data orchestration and visualization.

Our Business Intelligence team is dedicated to empowering Yelp's leadership and analytics teams with trusted and reusable data visualizations, data warehousing products, and BI platform support. The work of this team continuously evolves with our company’s needs and is critical to Yelp’s data driven decision making.

This opportunity is fully remote and does not require you to be located in any particular area in Canada. We welcome applicants from throughout Canada. We’d love to have you apply, even if you don’t feel you meet every single requirement in this posting. At Yelp, we’re looking for great people, not just those who simply check off all the boxes.

What you'll do:
Collaborate with stakeholders, partners and leadership to craft a vision, build the team’s technical roadmap and drive the team’s success.
Partner with engineering and product teams, as well as members of Yelp’s executive team, to design and deliver BI solutions, including datasets, self-serve and dashboards.
Lead teams that work cross-functionally to collect data and develop analytical capabilities.
Manage, coach, and mentor a team of BI Analysts with all experience levels.
Keep the team engaged and productive by removing obstacles and optimizing team processes.
Manage multiple projects simultaneously, prioritize tasks effectively, and adapt to changing priorities in a fast-paced environment.
Foster and build a fun, diverse, and inclusive culture that reflects Yelp’s values.

What it takes to succeed:
Previous experience as a technical lead and/or people-first-manager.
Ability to think strategically, understanding gaps and business needs to set the team up for success.
Strong knowledge of Business Intelligence best practices and industry standards to make organizational-level recommendations as needed.
Comfortable in your favorite visualization tools such as Tableau, Power BI, Google Analytics, etc.
Previous experience fostering cross-functional relationships across business stakeholders, leadership, product, data engineering and other partner teams.

What you'll get:
Compensation range is $160,000-190,000 annually. Depending on your role and level, you may also be offered a bonus, restricted stock units, and benefits.
This opportunity has the option to be fully remote in all locations across Canada.
You can find more information about Yelp's five star benefits here!

Closing
At Yelp, we believe that diversity is an expression of all the unique characteristics that make us human: race, age, sexual orientation, gender identity, religion, disability, and education — and those are just a few. We recognize that diverse backgrounds and perspectives strengthen our teams and our product. The foundation of our diversity efforts are closely tied to our core values, which include “Playing Well With Others” and “Authenticity.”

We’re proud to be an equal opportunity employer and consider qualified applicants without regard to race, color, religion, sex, national origin, ancestry, age, genetic information, sexual orientation, gender identity, marital or family status, veteran status, medical condition, disability, or any other protected status.

We are committed to providing reasonable accommodations for individuals with disabilities in our job application process. If you need assistance or an accommodation due to a disability, you may contact us at accommodations-recruiting@yelp.com or 1-415-969-8488.

Note: Yelp does not accept agency resumes. Please do not forward resumes to any recruiting alias or employee. Yelp is not responsible for any fees related to unsolicited resumes.

#LI-Remote

Recruiting and Applicant Privacy Notice",Yelp,Remote
"Corporate Project Manager, Reporting and Analytics","About Our Client: Our client is a leading B2B tech firm in the reward management and sales performance industry.

Position Scope: As the direct report to the CEO, the Corporate Project Manager assumes the role of acting as a conduit between the CEO and the leadership team in helping to build a CEO Dashboard that will organise, track and report on a number of core metrics including:

1. Daily, weekly, MTD and YTD corporate financial results: Tracking new client metrics against budgets

2. Monthly overheads versus budget and prior years

3. Major project tracking including: Project summary – core objectives, Estimated gross sales and margins by core project , IT deliverable schedules, Launch date – on track or changes

4. Sales Pipeline Tracking

5. Leadership Team Metrics – weekly and monthly KPI tracking

This entails establishing and maintaining data tracking and analysis infrastructure, as well as managing data collection, compilation, analysis, and application for executive-level reporting, strategic decision-making and project tracking. Additionally, the role encompasses the analysis and synthesis of reports tailored for both internal and external stakeholders including the companies Private Equity team and their daily, weekly and monthly reporting package. The Corporate Project Manager ensures proficient recording, monitoring, and reporting of data, while also crafting performance measures and indicators to enhance organizational effectiveness. This individual will ensure smooth project operations and deliverables to the CEO and the Private Equity Firm.

Responsibilities:

Collaborates with internal stakeholders such as Sales, Finance, IT and Customer Success to facilitate the identification and development of data tools essential for enhancing quality assurance, control, and overall operational efficiency.
Serves as a trusted strategic partner to the CEO, fostering collaborative efforts across teams to track projects, data analytics and generate valuable insights for the CEO and PE Firm.
Coordinates the creation and dissemination of dashboards and reports highlighting pertinent data trends, while identifying relevant data sources to fulfill reporting needs.
Tracks key metrics within sales, finance, and other critical projects to ensure performance alignment with organizational goals.
Establishes and communicates protocols for data collection, dissemination, and verification to ensure accuracy and reliability.
Manages and supports reporting requirements and research initiatives, including the design and implementation of evaluation methodologies and performance indicators.
Takes the lead in developing and implementing business intelligence tools to enhance decision-making processes.
Prepares and organizes data for both internal and external reporting purposes.
Supports the development and execution of data strategies across various organizational levels as needed.
Provides statistical insights to inform policy and procedural development.
Generates ad-hoc reports and dashboards to address specific informational needs

Required Skills and Knowledge:

Demonstrates strong capabilities in report writing, research, and project management, adhering to tight deadlines while effectively interpreting complex statistical data.
Creates visualizations, reports, and dashboards to monitor strategic Key Performance Indicators (KPIs) for both internal and external stakeholders.
Establishes a solid track record of engaging with senior leadership, executives, and partners to deliver in-depth data analysis.
Advocates for the adoption of new tools or methodologies to enhance data analytics and reporting capabilities.
Works autonomously, taking proactive ownership of key projects and supporting the implementation of strategic initiatives.
Exhibits exceptional problem-solving and analytical skills, with the ability to present complex information in a clear and concise manner.
Demonstrates prowess in team building and collaboration, fostering strategic partnerships with internal clients and external vendors.

Education and Experience:

Possesses a degree in Business Administration or a related field, preferred.
Brings a minimum of 5 years of experience in statistical data analysis, project management, database design, program evaluation, and report writing.
Previous experience providing project-based reporting for a PE firm is an asset.
Demonstrates proficiency in data management, integrating business intelligence and data collection methodologies for analysis, tracking, and reporting purposes.

Summit Search Group is a fair and equitable search firm. We welcome and encourage applications from people with disabilities. Accommodations are available on request for candidates taking part in all aspects of the recruitment and selection process.

Job Types: Full-time, Permanent

Schedule:

Monday to Friday

Work Location: In person",Summit Search Group,Toronto
Logistics Engineering Analyst,"Master, for over 70 years
We lead in HVAC-R and have been recognized among Canada's best-managed companies since 2010. As the foremost private HVAC-R distributor in the nation, we have over 1,300 active employees across 55+ branches, 4 distribution centers, spanning from British Columbia to the Atlantic provinces, and nearly 30 branches in the United States.
A Great Place To Work
At Master, we offer a dynamic, stimulating, and enjoyable environment. With a strong belief in healthy and open communication, we embrace a close approach with all our colleagues. Teamwork is integral to our values, and it is through it that we achieve our greatest successes.

?? Join Our Team as a Logistics Engineering Analyst! ??
Are you a highly motivated and experienced professional with a passion for logistics and efficiency? Master is seeking a talented Logistics Engineering Analyst to support our Eastern Region Distribution Centre and its management team. You'll play a crucial role in enhancing operational efficiency and driving continuous improvement initiatives. Ready to make a difference? Let's go! ??

What you will accomplish with us:

?? Continuous Improvement:

Identify key areas for process enhancement and cost reduction within the Distribution Centre and network.
Execute a comprehensive continuous improvement strategy aligned with our goals.

?? Process Analysis and Optimization:

Conduct a thorough analysis of processes and systems to find areas for improvement.
Design and implement process improvement initiatives using lean methodologies and Six Sigma principles.
Collaborate with cross-functional teams to develop standardized processes and best-in-class operational procedures.
Create training materials, work procedures (SOPs), and process models.
Develop performance metrics and KPIs to measure efficiency and track progress.

?? Data Analysis and Reporting:

Collect, analyze, and interpret operational data to identify trends and bottlenecks.
Generate reports and dashboards to communicate KPIs and project outcomes to stakeholders.
Navigate and make sense of raw data (SQL database).

?? Project Management and Training:

Manage process improvement projects from start to finish, ensuring goals, timelines, and budgets are met.
Coordinate with stakeholders, cross-functional teams, and external partners for successful project implementation.
Provide training and guidance on process improvement initiatives.

??? Distribution Center Design:

Oversee the design and layout of distribution centers to optimize space and material flow.
Collaborate with engineering and operations teams to implement design changes that enhance productivity and operational excellence.

What You Bring to Our Team:

?? Education & Experience:

Bachelor's degree in Industrial Engineering or related field (Advanced degree is a plus).
1 to 3 years of experience in a similar position, preferably in a Distribution Centre or logistics environment.

??? Skills & Knowledge:

Proven experience in process improvement using lean methodologies and Six Sigma principles.
Proficiency in data analysis and visualization tools (SQL, PowerBI, Alteryx required).
Strong project management skills with the ability to handle multiple projects simultaneously.
Knowledge of AutoCAD (required) for Distribution Center layout designs.
Advanced knowledge of Excel (VBA required) and Microsoft Office suite (Visio an asset).
Understanding of ERP and WMS software (SX Enterprise and TWL software an asset).

?? Personal Attributes:

Motivated self-starter with the ability to work independently or as part of a team.
Excellent communication and interpersonal skills.
Results-oriented with a passion for continuous improvement and operational excellence.

?? Location & Language:

Based in Boucherville, Quebec, with occasional travel required (Canada/US).
Proficiency in both English and French.

Ready to join an amazing team and drive our success to new heights? Apply now and let's make an impact together! ?????

Competitive Benefits: In addition to a rewarding career within our team, we offer

Medical and dental coverage from day one, along with short and long-term disability protection
Contribution to a collective registered retirement savings plan upon starting your role.
Wellness spending account
An employee assistance program including psychological, financial, and legal support.
Access to telemedicine from the beginning of your employment.
Reimbursement of professional association membership fees.
Early vacation program.
Flexible remote work policy",The Group Master,Boucherville
