Job Title,Job Description,Company Name,Location
"Budget Analyst, Engineering","When applicable, Bombardier promotes flexible and hybrid work policies.

Why join us?

At Bombardier, we design, build and maintain the world’s peak-performing aircraft for the world’s most discerning people and businesses, governments and militaries. We have been successful in setting the highest standards by putting our people at the heart of it all, and defining excellence, together.


Working at Bombardier means operating at the highest level. Every day, you are part of a team that delivers superior experiences and products, pushing the boundaries of what's possible in our industry and beyond. By prioritizing employee growth and development, we empower everyone to reach their full potential on their own terms, because the best work happens when you are free to be yourself and share your unique expertise.

Bombardier’s Benefits Program

With our employees’ well-being top of mind, we offer a comprehensive and competitive Benefits Program, which includes the following:

Insurance plans (Dental, medical, life insurance, disability, and more)
Competitive base salary
Retirement savings plan
Employee Assistance Program
Tele Health Program
What are your contributions to the team?

The role of Budget Analyst, Engineering is to control, plan and manage the various budgetary aspect for the Engineering and Product Developmentt group. This include supporting the yearly budget planification and quarterly forecast phases, updating & tracking on weekly / monthly basis budget actual spend, reviewing & analyzing budget actual data and supporting and / or developing the required reporting tools / reports. You will be reporting to the Governance, Strategy and Budget management group of Engineering and Product Development.




Manage weekly/monthly budget tracking and reporting for various budget categories (Clocking hours, capitalize budget, indirect hours, other direct cost, major department expenses…);
Participate in annual budget planification and quarterly reforecast exercises;
Validate data reported in weekly/monthly Finance team reports to ensure data accuracy and to identify/resolve any discrepancies;
Analyze budget spend and give visibility to management on the risks and opportunities;
Lead and/or participate in review meeting with engineering, programs office and finance group to ensure that the budget is aligned and respected with the allocated envelopes;
Maintain, develop and/or improved Power BI reports / dashboard to provide budget status visibility
Participate in tools and report development to facilitate data analysis and reporting.
How to thrive in this role?



You have a minimum of 5 years of experience in Finances, Project Management or Business Administration;
You hold a bachelor’s degree in Finances, Engineering, Business Administration or equivalent;
You have strong financial skills with an analytical mind;
You are autonomous, rigorous, organized and quality-focused
You have very good computer skills (MS Office; advanced Excel, intermediate Power Point, advanced Power BI, intermediate SQL);
You are comfortable interacting/presenting to all levels of management, including senior leadership
You work effectively with cross-functional teams
You have strong bilingual oral & written skills.


Please note: You don’t need all the skills, knowledge, and experience listed for this position! We’re not looking for the perfect candidate, we’re looking for great talent and resourcefulness.


Bombardier is an equal opportunity employer and encourages persons of any race, religion, ethnicity, gender identity, sexual orientation, age, immigration status, disability or other applicable legally protected characteristics to apply.


Job Budget Analyst, Engineering

Primary Location Administrative Centre (CA)

Organization Aerospace Canada

Shift Day job

Employee Status Regular

Requisition 4467 Budget Analyst, Engineering",Bombardier,Dorval
Analyste multidisciplinaire en mécanique / Multi-Disciplinary Mechanical Analyst,"Date d’affichage / Date Posted:

2024-03-25

Pays / Country:

Canada

Emplacement / Location:

LOC13052 1000 Boul Marie Victorin,Longueuil,Quebec,J4G 1A1,Canada

English version will follow:

Qui nous sommes

Chez Pratt & Whitney, nous croyons que le vol motorisé a transformé, et continuera de transformer, le monde. C'est pourquoi nous travaillons avec un cœur d'explorateur et un acharnement de perfectionniste à concevoir, produire et entretenir les moteurs d'avion les plus avancés et les plus fiables du monde. Notre portefeuille diversifié - composé de moteurs commerciaux et militaires ainsi que de moteurs destinés à l'aviation d'affaires, générale et régionale, et aux hélicoptères – nous permet, ainsi qu’à nos clients, de passer du possible au réel. C'est ainsi que, chez Pratt & Whitney, nous abordons notre travail et ce qui nous inspire à nous dépasser.

Quelles sont nos attentes ?
Analyste Mécanique Multidisciplinaire: Expérience et/ou éducation en analyse structurale (contraintes, thermique, modale, dynamique), fluidique (CFD, Hydrodynamique) et analyse de durabilité (fatigue/fretting/usure). Vous aurez l'opportunité de développer une vaste gamme de connaissances et compétences tant sur le plan analytique que pratique.

À quoi ressemblera votre quotidien ?
Au sein d’une équipe de recherche et développement d’un nouveau type de moteur aéronautique, le New Small Engine (""NSE""), vous aurez à:

Contribuer au développement des composantes principales (core) du moteur pour en optimiser le rapport poids/puissance et l’efficacité tout en rencontrant les requis de durabilité.

Développer, valider et améliorer des modèles de simulations de composants et de systèmes en se basant sur les résultats d’essais et l’inspection de l'état des composants à la suite des essais.

Analyser par éléments finis (thermique, statique non-linéaire, modale, harmonique) et dynamique des fluides numériques (CFD/CHT). Simulation dynamique avec corps déformables et modèles de lubrification (EHD/mixte). Analyse multi-physique par couplage de différents logiciels.

Analyser la durabilité (fatigue/fretting et usure) et la lubrification.

Effectuer, planifier ou coordonner des essais de matériaux (fatigue/fluage, tribologie). Afficher le poste envoyé aux employés permanents de l'ingénierie.

Collaborer étroitement avec les ingénieurs d'assemblage et de test. Spécifier les procédures de test et les instruments. Analyser des données de test, y compris les températures, les pressions/contraintes/vibrations.

Participer aux investigations et aux analyses des causes fondamentales.

Ce dont vous avez besoin pour réussir

Baccalauréat en ingénierie ou l'équivalent avec deux (2) à dix (10) ans d’expérience.

Maîtrise ou doctorat dans un domaine pertinent sera considéré comme un atout.

Le candidat doit être adaptable, motivé et avoir démontré des capacités à travailler efficacement dans le cadre de délais de projet serrés.

Curiosité, initiative et excellentes capacités d’auto-apprentissage.

Raisonnement analytique et habileté à résoudre des problèmes complexes. Capacité de travailler avec un minimum de procédures suivant les principes fondamentaux.

Aptitudes et intérêts en programmation (automatisation des analyses, analyses de données).

Connaissance fondamentale de la méthode des éléments finis et des logiciels Ansys Mechanical et APDL.

Connaissance des logiciels Catia V5 (base), Matlab, CFX

Capacité de communiquer en français à l'oral et à l'écrit. Travail en présentiel requis.

Ce que nous offrons

Programme de congé à rémunération différée

Programmes d’avancement professionnel et de scolarisation

Horaires flexibles

Programmes et formations sur le leadership

Gamme d’avantages sociaux, régime d’épargne et régime de retraite

Programme d’aide de financement pour les congés parentaux

Programme de reconnaissance et de récompense


Diversité, Équité et Inclusion
Le générique masculin est utilisé sans discrimination et uniquement dans le but d'alléger le texte. P&WC souscrit au principe de l’équité en matière d’emploi et est déterminé à encourager la diversité et l’inclusion. Nous sommes heureux d’étudier la demande d’emploi de tous les candidats qualifiés, sans égard à leur race, couleur, religion, orientation sexuelle, genre, nationalité d’origine, âge, handicap, statut d’ancien combattant ou tout autre statut protégé par la loi.

****************************************************************

Who we are

At Pratt & Whitney, we believe that powered flight has transformed – and will continue to transform – the world. That’s why we work with an explorer’s heart and a perfectionist’s grit to design, build, and service the world’s most advanced aircraft engines. We do this across a diverse portfolio – including Commercial Engines, Military Engines, Business Aviation, General Aviation, Regional Aviation, and Helicopter Aviation – and as a way of turning possibilities into realities for our customers. This is how we at Pratt & Whitney approach our work, and this is why we are inspired to go beyond.

What are our expectations?
Multidisciplinary powerplant mechanical analyst: Background in structural analysis (Stress, thermal, modal, dynamic), fluid mechanics (CFD, hydrodynamics) and durability analysis (fretting/fatigue/wear). This job will allow the candidate to develop with a wide range of knowledge and competencies, covering and cross-linking theoretical and practical.

What your day to day will look like?

Part of the research and development on a new type of engine, the New Small Engine (""NSE"") different from a gas turbine, you will:

Contribute to develop engine core components for optimum power-to-weight & efficiency while meeting durability requirements.

Develop, validate, and improve system and component-level models based on test results & post-test hardware inspection.

Finite element analysis (thermal, static nonlinear, modal, harmonic) et fluid dynamics (CFD/CHT). Multiple-body Simulation (MBS) with lubrication models (EHD/mixed). Multi-physics analysis through software coupling.

Durability analysis (fatigue/fretting/wear) and lubrication (EHD/mixed/boundary).

Perform, plan and coordinate material testing (Creep/Fatigue and/or Tribology).

Close collaboration with Assembly & Test engineers. Specify test procedures & instrumentation. Test data analysis including temperatures, pressures/stress/vibration.

Support investigations & root cause analysis.

The tools you need to be successful

Bachelor in mechanical engineering or equivalent with 4 to 10 years of experience.

Master in a relevant discipline will be considered an asset.

Candidate must be adaptable, self-motivated, and have demonstrated abilities to work effectively under aggressive project timelines.

Curious with initiative and strong self-learning capabilities.

Analytical thinking and aptitudes towards the resolution of complex problems. Capacity to work with minimal instructions, following first principles.

Programming skills and interests (process automation, data analysis…).

Fundamental Knowledge of the Finite Element Method as well as Ansys Mechanical and APDL.

Functional in Catia V5, Matlab, CFX/Fluent.

Functional French Communication (Oral & Written). On-site presence is required.

What we offer

Long-term deferred compensation programs

Advancement programs to enhance education skills

Flexible work schedules

Leadership and training programs

Comprehensive benefits, savings and pension plans

Financial support for parental leave

Reward programs for outstanding work

Diversity, Equity & Inclusion

The masculine pronoun is used without discrimination and solely for the purpose of making the text easier to read. P&WC is an equal opportunities employer, seeking to promote diversity and inclusion. We will consider applications from all qualified candidates, regardless of their race, colour, religion, sexual orientation, gender, nationality, age, disability, veteran status or any other status protected by law.

RTX is An Equal Opportunity/Affirmative Action Employer. All qualified applicants will receive consideration for employment without regard to race, color, religion, sex, sexual orientation, gender identity, national origin, disability or veteran status, age or any other federally protected class.

Privacy Policy and Terms:

Click on this link to read the Policy and Terms",Pratt & Whitney,Longueuil
Vehicle Analyst,"Company Description


Accelerate your career with a fast-growing global engineering group. At SEGULA Technologies, you'll work on exciting projects and help shape the future in a company where innovation goes hand in hand with engineering.

3D printing, augmented reality, autonomous vehicles, the factory of the future... these are the daily rhythms of our 10,000 ingenious employees, so why not yours?

Whether next door or on the other side of the world, at SEGULA Technologies you'll find the opportunity that will give new meaning to your career!


Job Description


Our Quality Team is seeking a Vehicle Analyst to join our team within the automotive industry, dedicated to ensuring the achievement of all project quality targets, managing launch timelines and deliverables, and facilitating the seamless transition to high-quality volume production.

Specific Responsibilities include, but are not limited to:

Validating product and process design and assembly at the geometric level within the assigned scope (Quality Assurance Fixtures management).
Participating in the development of the geometric monitoring plan at the Assembly line.
Ensuring the convergence of geometric quality in the industrialization phase before volume production.
Reporting component and assembly quality issues, actively participating in activities to resolve issues related to design, part conformity, and manufacturing.
Conducting analyses, identifying quality optimization solutions, defining pilots for each issue, and facilitating communication to ensure conformity to BCI Key Performance Indicators (KPIs).
Reading part dimensional data and resolving interior fit and finish issues.
Leading coordination activities with other company organizations such as HMI, Corp Quality, SQ & Perceived Quality related to Interior Execution.
Conducting high-level presentations requiring proficiency in Excel, PowerPoint, and excellent communication skills.

Qualifications

Minimum of a Bachelor of Science degree in Mechanical or Electrical Engineering or equivalent (Materials/Chemical/Civil/Aerospace)
Minimum of 3-5 years' experience in automotive areas of Product Engineering, Manufacturing, Supplier Quality, and/or Product Quality.
Knowledge of Advanced Product Quality Planning (APQP), Production Part Approval Process (PPAP), and Supplier Quality Manual.

• Proficiency in statistical data analysis, metrology principles, and Root Cause Analysis methods. • Knowledge of defect resolution, escalation processes, and follow-up.

Understanding of metrology principles and proficiency in statistical analysis and process control.
Understanding of vehicle design, assembly, and process control.
Familiarity with tooling and in-plant processes.
Strong analytical, problem-solving, and communication skills with the ability to work with cross-functional teams.
Ability to develop an action plan and drive procedures for issue resolution.
Self-motivated, able to meet deadlines, and capable of working effectively with cross-functional teams.
Strong analytical and communication skills, along with the ability to develop action plans and drive procedures for issue resolution.

Additional Information


SEGULA TECHNOLOGIES is a company committed to diversity, and we recognize and recruit all kinds of talent.",Segula Technologies,Windsor
Pavement Analyst - Infrastructure Management & Pavement Engineering,"Pavement Analyst - Infrastructure Management & Pavement Engineering - ( 240001PN )

Description

We are strategizing, planning, and implementing projects that help clients achieve their organization’s objectives. Join our award-winning program management team and bring transformational project solutions to life.

Your Opportunity

Stantec’s Infrastructure Management and Pavement Engineering (IMPE) Group is a recognized leader in pavement engineering, integrated infrastructure /asset management consulting, and related data collection activities.

We have vast experience in pavement engineering and management, providing clients with sustainable pavement solutions. We are well-recognized through projects successfully completed throughout North America and abroad.

Our team based in Southern Ontario is seeking a Pavement Analyst who will provide their technical expertise and will work closely with a team of Pavement Engineers and Project Managers focused on collaboration, integrated design, client service and business success.

Your Key Responsibilities

In this role, you will be accountable to various Project Managers who manage pavement data collection, pavement engineering and pavement management projects across North America. Our clients range from municipalities to provincial/State transportation departments and the private sector. Key responsibilities include (but are not limited to):

Supporting Project Managers with pavement management tasks, including project setup, data review and management, data loading, pavement management model development, data analysis, and report writing.
Assist with client management and act as client liaison when required.
Managing and organizing field and spatial data to ensure quality and consistency.
Pavement data quality control, including daily field data checks.
Preparing for field surveys including route planning.
Processing pavement condition data: assets, images, distress, roughness, and GPS data.
Working with spatial data in GIS and writing queries.
Coordinating with team members and project managers to assemble data packages for delivery to clients.
Loading, analyzing, and documenting pavement performance and sectional attribute data.
Assisting in preparing pavement management reports.

Qualifications

Your Capabilities and Credentials

Strong problem-solving abilities and attention to detail are essential.
Exposure to analytical data and proficiency in working with MS Excel, MS Access, GIS, geospatial databases, and overall understanding of database management are essential.
Knowledge of FME software and/or experience with programming is considered an asset.
Capable of working both independently and in a team environment.
Time-management skills – ability to work under pressure with dynamic deadlines.
Knowledge of relevant AASHTO and ASTM Standards related to asphalt and pavements is considered an asset.
Experience with pavement management software is considered an asset.
Well-developed written communication skills in the preparation of technical reports, correspondence and proposals are considered an asset.

Education and Experience

Bachelor’s degree in an Engineering field, GIS, Database Management, or Technical degree/diploma/certificate or equivalent in related field.
2 years of relevant consulting experience within the civil/pavement engineering disciplines.
A Master’s or Ph.D. in Pavement Engineering will be considered in lieu of work experience.

Typical office environment working with computers and remaining sedentary for long periods of time. Field work may include exposure to the elements including inclement weather.

This description is not a comprehensive listing of activities, duties or responsibilities that may be required of the employee and other duties, responsibilities and activities may be assigned or may be changed at any time with or without notice.

Stantec is a place where the best and brightest come to build on each other’s talents, do exciting work, and make an impact on the world around us. Join us and redefine your personal best.

Benefits Summary: Regular full-time and part-time employees will have access to health, dental, and vision plans, a well-being program, health care spending account, wellness spending accounts, group registered retirement savings plan, employee stock purchase program, group tax-free savings account, life and accidental death & dismemberment (AD&D) insurance, short-term/long-term disability plans, emergency travel benefits, tuition reimbursement, professional membership fee coverage, and paid time off.

Temporary/casual employees will have access to group registered retirement savings plan, employee stock purchase program, and group tax-free savings account.

The benefits information listed above may not apply to union positions because benefits for such positions are governed by applicable collective bargaining agreements.

Primary Location : Canada-Ontario-Waterloo

Other Locations : Canada

Organization : BC-1620 Transpt-CA Ontario West IMPE

Employee Status : Regular

Job Level : Individual Contributor

Travel : Yes, 20 % of the Time

Schedule : Full-time

Job Posting : Apr 17, 2024, 11:11:28 AM

Req ID: 240001PN

Stantec provides equal employment opportunities to all qualified employees and applicants for future and current employment and prohibit discrimination on the grounds of race, color, religion, sex, national origin, age, marital status, genetic information, disability, protected veteran status, sexual orientation, gender identity or gender expression. We prohibit discrimination in decisions concerning recruitment, hiring, referral, promotion, compensation, fringe benefits, job training, terminations or any other condition of employment. Stantec is in compliance with local, state and federal laws and regulations and ensures equitable opportunities in all aspects of employment. EEO including Disability/Protected Veterans",Stantec,Waterloo
