Job Title,Job Description,Company Name,Location
Sr Synthetic Aperture Radar (SAR) Processing Analyst,"Building the space between proven and possible, MDA Space (TSX:MDA) is a trusted mission partner to the global space industry. A robotics, satellite systems and geointelligence pioneer with a 55-year+ story of world firsts and more than 450 missions, MDA Space is a global leader in communications satellites, Earth and space observation, and space exploration and infrastructure. The MDA Space team of more than 3,000 space experts in Canada, the US and the UK has the knowledge and know-how to turn an audacious customer vision into an achievable mission – bringing to bear a one-of-a-kind mix of experience, engineering excellence and wide-eyed wonder that’s been in our DNA since day one. For those who dream big and push boundaries on the ground and in the stars to change the world for the better, we’ll take you there.

Are you ready to launch the next stage of your career in the new space economy? We would love to hear from you!

The Position

We are on the hunt for a Senior Synthetic Aperture Radar (SAR) Processor Analyst at our Richmond, BC, Canada office, to be a part of the next generation of Earth Observations space missions.

From detecting changes in fragile ecosystems to monitoring northern ice floes and shipping routes, our near-real time Earth observation data makes our Geointelligence team a leader in geospatial imagery, ground stations, enterprise geospatial systems and defence programs. You will join our remote sensing team that has 30+ years of experience delivering commercial and government projects such as RADARSAT-2, RapidEye, Sapphire, CASSIOPE, RADARSAT Constellation Mission and now the CHORUS Constellation of SAR satellites.

Role

This is a role suited for an ambitious professional wanting to solve complex problems and develop novel algorithms that contribute to the betterment of our world. You will contribute to our world leading Synthetic Aperture Radar processors by developing novel signal processing algorithms that generate high value imagery and real-time actionable intelligence for our customers.

Responsibilities

As a Senior Synthetic Aperture Radar (SAR) Processor Analyst, you may have a wide range of responsibilities that include:

Develop novel signal processing algorithms to push the boundaries of SAR performance (resolution, swath width, Moving Target Indication (MTI) and more);
Design, develop, maintain and enhance high quality SAR processor models and prototypes using current best practices in architecture and software development;
Participate in trade-off studies and find solutions to ensure algorithms are implementable on real hardware (processor and radar HW);
Investigate, troubleshoot, determine root causes and mitigate signal processing errors or induced artefacts in SAR image products;
Performs system level analyses and develops models to predict and test system performance;
Develops solutions to improve image quality;
Develops and executes calibration plans for SAR missions;
Coordinates SAR processing requirements and development with other stakeholders (payload team, applications, business development);
Generates clear and thorough written reports documenting complex algorithms and technical performance; and
Mentoring and coaching of junior team members.

Required Experience:

Undergraduate degree or higher in Electrical Engineering, Engineering Physics, Math, Physics, or a combination of related education and experience;
8 years of experience working in an engineering or technical environment or 4 years with a relevant post graduate degree ;
6 or more years working on complex signal processing systems (e.g. Radar, Medical Imaging, Sonar, etc);
Solid understanding of the principles and practices concerning the design of high speed and high throughput data analysis and transmission;
Ability and knowledge to work with MATLAB, Python or C++;
Self-starter with the ability to perform in a dynamic working environment;
Possess excellent problem solving skills;
Excellent interpersonal, verbal and written communication skills to explain concepts to wide-ranging audiences (e.g. technical team, sales team, executives, customers, etc); and
The ability to work within a large organization and understand dependencies and stakeholder needs.

Desired Experience:

A post-graduate degree in a field involving complex signal processing;
Appreciation of SAR remote sensing, including system design, operation, applications/exploitation and calibration;
Appreciation for satellite based SAR Payload design and operations;
Appreciation and understanding of modern software development methodologies;
Experience in different types of engineering life cycles as applicable from large complex programs to software development;
Appreciation for algorithm implementation on FPGA;
Ability to learn new technologies and space borne remote sensing domain knowledge quickly; and
A strong understanding of geospatial data.

We’re a dream team of purpose-driven, collaborative and passionate people, and we are constantly looking for others to join #TeamMDA to ignite new and innovative approaches to problem-solving that push us forward to improve life on and above Earth. If you’re excited to expand our place in space and driven to inspire the next generation, we’ll take you there.

We have entered a new era of exploration and development, and MDA welcomes all who yearn to suit up and be part of it. An equal opportunity employer prizing diversity, integrity and collaboration, we are committed to growing MDA’s and Canada’s leadership in this next golden age.

The compensation range for this position is $98,000 - $144,100 annually. The specific compensation offered will be based on the qualifications and experience of the successful candidate.

Comments/Special Considerations:

Successful candidates must obtain and hold security clearance at the RELIABILITY status level, and pass security assessment for the Controlled Goods Program (CGP).

MDA provides competitive compensation and benefits packages for its employees at all locations. As a team member of MDA, you and your qualified dependents are eligible to participate in a benefit plan that ensures a comprehensive level of protection through competitive health care including; extended healthcare and flexible drug plans, dental and vision benefits, disability income protection, life insurance, group retirement savings plans; and an employee and family assistance program.

MDA is an equal opportunity employer prizing diversity and inclusion. We are committed to treating all employees and applicants for employment with respect and dignity. If you require assistance and/or reasonable accommodation due to a disability during the application or the recruiting process, please feel free to notify us.

#LI-Hybrid #IND #LI-EP1",MacDonald Dettwiler & Associates Inc.,Richmond
Bi-Lingual Construction Project Manager,"Construction Project Manager (Bilingual - English/French)

Baycrest Project & Construction Management, Toronto




Baycrest has been rapidly growing over the past few years and are looking for an

experienced Project Manager to join our team. As a project manager, you will oversee

the planning, execution, and delivery of projects. Key Deliverables in the role will be to

ensure projects are delivered on time and in budget, meeting team quarterly performance

objectives and ensuring a great customer experience.




Responsibilities

Review and understand the project drawings and specifications/scope of work for each project
Interpret building plans, regulations and building codes to direct the progress of work and monitor compliance with construction documents
Liaise with project managers, designers, engineers, clients, and governing authorities to achieve the scope of work
Ensure contract objectives, policies, procedures, and performance standards are met in accordance with company policy and contract specifications
Monitor and lead the progress of construction to ensure the project is completed on time and within budget, jointly with the project supervisor.
Follow fiscal policy set by management
Complete a cost budget analysis for each project and continually review project cost
reports within the company’s accounting software
Complete monthly progress draws to align with sub-contractor progress payments and the Construction Act, R.S.O. 1990, c. C.30.
Complete approvals for AP processing
Understand client drivers and offer value engineering
Provide superior and utmost service to clients, suppliers and other stakeholders by responding professionally and with a sense of urgency
Lead construction progress meetings as required
Create and update the project schedules as required to ensure project milestones and project deliverables are met; follow the critical path
Negotiate and issue sub-contracts and purchase orders
Understand, communicate and enforce the contract and contract documents
Review, track and monitor shop drawings and material lead times
Mitigate any issues that may arise during the course of a project
Provide all building inspection documents and coordinate inspections with City
Inspectors to ensure the closure of permits have been completed
Complete the overall project closeout
Meet key targets and KPI’s set by management
Report and communicate project updates to all project stakeholders
Participate in the completion of Prequalification’s, Tenders and RFP’s
Report to the Director of Project Operations and Management team on a weekly basis on the status of your projects and ensuring monthly revenue targets are met
Ensure all site activity is completed in accordance with health and safety regulations
Be aware of the applicable legislation and company procedures
Ensure that workers comply with the Occupational Health and Safety Act, applicable regulations and the company’s policy and program.



Skills & Experience

Preferably certificate, diploma or degree in Civil Engineering and/or Construction Project Management
6+ years related experience in the ICI Construction Industry
Capable of reading and understanding construction drawings and documents
Strong knowledge of construction processes through all phases – startup through construction and closeout
Proactively identify problems / issues and develop effective solutions
Proficient in Microsoft Office including Outlook, Excel, PowerPoint, Microsoft Project - Project management software (an asset)
Confidence and professionalism to communicate effectively with clients, designers, subcontractors and peers
Self- motivated with the ability to take initiative and work in a fast-paced environment, handling competing demands
Highly organized, detail oriented, solid time-management skills
Knowledge of COR Health & Safety Certification system an asset
Knowledge of Procore an asset
Works well with others and the ability to work under minimal supervision
Ability to work under pressure
Must hold a valid driver’s licence and access to reliable transportation
Must be fluent in French and English (written and verbal communication)



Employment Type

Full-time",Baycrest Project & Construction Management,Toronto
